,video_filename,scenario_id,scenario_name,difficulty,R_cm,D_cm,p_cm,f_cm,q_cm,magnification,Q_conceptual,A_conceptual,Q_numerical,A_numerical,Q_error_detection,A_error_detection
0,convexmirror_scenario_id_1_difficulty_easy_.mp4,1,"Far object, weak mirror",easy,300,80,300,-150,-100.0,0.333,"(PhET; convex spherical mirror; R=300 cm, D=80 cm, p=300 cm; f=−R/2=-150 cm; sign: real q>0, virtual q<0; use 1/f=1/p+1/q) For a far object in a weak (long-R) convex mirror, describe the image type and how its size compares to the object.","Convex mirrors always form virtual, upright, reduced images (q<0, 0<|m|<1). Farther p gives smaller |m|.","(PhET; convex spherical mirror; R=300 cm, D=80 cm, p=300 cm; f=−R/2=-150 cm; sign: real q>0, virtual q<0; use 1/f=1/p+1/q) Compute q and magnification m to 3 s.f.","q=(f·p)/(p−f)=(-150·300)/(300−-150)=-100 cm (negative, virtual); m=−q/p=0.333.","(PhET; convex spherical mirror; R=300 cm, D=80 cm, p=300 cm; f=−R/2=-150 cm; sign: real q>0, virtual q<0; use 1/f=1/p+1/q) Name two assumptions that, if violated, would alter |m|.",Paraxial rays (avoid edge rays) and consistent screen scale; on-axis object.
1,convexmirror_scenario_id_2_difficulty_easy_.mp4,2,"Nearer object, weak mirror",easy,300,100,200,-150,-85.7,0.429,"(PhET; convex spherical mirror; R=300 cm, D=100 cm, p=200 cm; f=−R/2=-150 cm; sign: real q>0, virtual q<0; use 1/f=1/p+1/q) Compared to #1, does bringing the object closer increase or decrease |m|? Explain.","Closer p increases |m| (image less reduced), still virtual and upright.","(PhET; convex spherical mirror; R=300 cm, D=100 cm, p=200 cm; f=−R/2=-150 cm; sign: real q>0, virtual q<0; use 1/f=1/p+1/q) Compute q and m.",q=-85.7 cm; m=0.429.,"(PhET; convex spherical mirror; R=300 cm, D=100 cm, p=200 cm; f=−R/2=-150 cm; sign: real q>0, virtual q<0; use 1/f=1/p+1/q) What sim artifact can make |m| appear unchanged when p changes?",Auto-scaling/zoom; keep measurement scale fixed.
2,convexmirror_scenario_id_3_difficulty_moderate_.mp4,3,"Close object, weak mirror",moderate,300,120,100,-150,-60.0,0.6,"(PhET; convex spherical mirror; R=300 cm, D=120 cm, p=100 cm; f=−R/2=-150 cm; sign: real q>0, virtual q<0; use 1/f=1/p+1/q) Why is the image less reduced here than #1 and #2?",Smaller p increases |m| in convex mirrors (still <1).,"(PhET; convex spherical mirror; R=300 cm, D=120 cm, p=100 cm; f=−R/2=-150 cm; sign: real q>0, virtual q<0; use 1/f=1/p+1/q) Compute q and m.",q=-60 cm; m=0.6.,"(PhET; convex spherical mirror; R=300 cm, D=120 cm, p=100 cm; f=−R/2=-150 cm; sign: real q>0, virtual q<0; use 1/f=1/p+1/q) Which sign mistake would predict a real image?",Using f=+R/2 or taking q>0 for convex.
3,convexmirror_scenario_id_4_difficulty_moderate_.mp4,4,"Far object, strong mirror",moderate,150,80,250,-75,-57.7,0.231,"(PhET; convex spherical mirror; R=150 cm, D=80 cm, p=250 cm; f=−R/2=-75 cm; sign: real q>0, virtual q<0; use 1/f=1/p+1/q) Compare weak vs. strong convex mirrors for a far object: which gives a larger image?",Stronger (shorter |f|) gives larger |m| at same p.,"(PhET; convex spherical mirror; R=150 cm, D=80 cm, p=250 cm; f=−R/2=-75 cm; sign: real q>0, virtual q<0; use 1/f=1/p+1/q) Compute q and m.",q=-57.7 cm; m=0.231.,"(PhET; convex spherical mirror; R=150 cm, D=80 cm, p=250 cm; f=−R/2=-75 cm; sign: real q>0, virtual q<0; use 1/f=1/p+1/q) What else changes when D differs?","Brightness and aberrations via NA; geometry (q,m) unchanged."
4,convexmirror_scenario_id_5_difficulty_moderate_.mp4,5,"Near object, strong mirror",moderate,150,120,120,-75,-46.2,0.385,"(PhET; convex spherical mirror; R=150 cm, D=120 cm, p=120 cm; f=−R/2=-75 cm; sign: real q>0, virtual q<0; use 1/f=1/p+1/q) Which gives a larger image: this or #3? Use f and p to justify.","Here f=−75 (strong) but p=120 vs p=100 (#3). Numerically |m|≈0.385 < 0.600 (#3), so #3 is larger.","(PhET; convex spherical mirror; R=150 cm, D=120 cm, p=120 cm; f=−R/2=-75 cm; sign: real q>0, virtual q<0; use 1/f=1/p+1/q) Compute q and m.",q=-46.2 cm; m=0.385.,"(PhET; convex spherical mirror; R=150 cm, D=120 cm, p=120 cm; f=−R/2=-75 cm; sign: real q>0, virtual q<0; use 1/f=1/p+1/q) Two pitfalls when comparing across clips?",Different object heights / on-screen scales; off-axis placement.
5,convexmirror_scenario_id_6_difficulty_hard_.mp4,6,Very close object,hard,200,100,60,-100,-37.5,0.625,"(PhET; convex spherical mirror; R=200 cm, D=100 cm, p=60 cm; f=−R/2=-100 cm; sign: real q>0, virtual q<0; use 1/f=1/p+1/q) Very close object: explain why image gets larger yet stays virtual.","Convex mirrors always have q<0; as p decreases, |m| increases but remains <1.","(PhET; convex spherical mirror; R=200 cm, D=100 cm, p=60 cm; f=−R/2=-100 cm; sign: real q>0, virtual q<0; use 1/f=1/p+1/q) Compute q and m.",q=-37.5 cm; m=0.625.,"(PhET; convex spherical mirror; R=200 cm, D=100 cm, p=60 cm; f=−R/2=-100 cm; sign: real q>0, virtual q<0; use 1/f=1/p+1/q) What could falsely suggest |m|>1?",Tilted/zoomed screen or different object scales.
6,convexmirror_scenario_id_7_difficulty_hard_.mp4,7,Compare diameters,hard,200,60,100,-100,-50.0,0.5,"(PhET; convex spherical mirror; R=200 cm, D=60 cm, p=100 cm; f=−R/2=-100 cm; sign: real q>0, virtual q<0; use 1/f=1/p+1/q) Same geometry as #8 but smaller D—predict visibility/quality changes.","Smaller D → dimmer + more diffraction, less edge aberration; q,m unchanged.","(PhET; convex spherical mirror; R=200 cm, D=60 cm, p=100 cm; f=−R/2=-100 cm; sign: real q>0, virtual q<0; use 1/f=1/p+1/q) Compute f-number N=|f|/D and relative brightness vs D=120.",N≈1.67; brightness ~(D/120)^2≈0.25.,"(PhET; convex spherical mirror; R=200 cm, D=60 cm, p=100 cm; f=−R/2=-100 cm; sign: real q>0, virtual q<0; use 1/f=1/p+1/q) What sim setting hides brightness changes?",Auto-exposure.
7,convexmirror_scenario_id_8_difficulty_hard_.mp4,8,Diameter max-out,hard,200,120,100,-100,-50.0,0.5,"(PhET; convex spherical mirror; R=200 cm, D=120 cm, p=100 cm; f=−R/2=-100 cm; sign: real q>0, virtual q<0; use 1/f=1/p+1/q) Compared to #7, what changes when D is maxed?","Brighter, less diffraction, more aberration possible; q,m unchanged.","(PhET; convex spherical mirror; R=200 cm, D=120 cm, p=100 cm; f=−R/2=-100 cm; sign: real q>0, virtual q<0; use 1/f=1/p+1/q) Compute N and brightness gain vs D=60.",N≈0.833; brightness gain ≈ 4.0×.,"(PhET; convex spherical mirror; R=200 cm, D=120 cm, p=100 cm; f=−R/2=-100 cm; sign: real q>0, virtual q<0; use 1/f=1/p+1/q) Why might the wide case still look softer?",Edge aberrations at high NA.
8,convexmirror_scenario_id_9_difficulty_hard_.mp4,9,Radius deduction,hard,180,100,120,-90,-51.4,0.429,"(PhET; convex spherical mirror; R=180 cm, D=100 cm, p=120 cm; f=−R/2=-90 cm; sign: real q>0, virtual q<0; use 1/f=1/p+1/q) Given measured q (virtual), deduce f and R.","Use 1/f=1/p+1/q (q<0), then R=−2f.","(PhET; convex spherical mirror; R=180 cm, D=100 cm, p=120 cm; f=−R/2=-90 cm; sign: real q>0, virtual q<0; use 1/f=1/p+1/q) Compute f and R numerically.",f=-90 cm; R≈180 cm.,"(PhET; convex spherical mirror; R=180 cm, D=100 cm, p=120 cm; f=−R/2=-90 cm; sign: real q>0, virtual q<0; use 1/f=1/p+1/q) Which sign mistakes break the inference?",Taking q>0 or f=+R/2.
